{
  "$schema": "../../../../deploy/ha/workload-profile.schema.json",
  "schema_version": 1,
  "workload_id": "drill-quiet-control",
  "workload_class": "soak",
  "description": "LOCAL single-host engineering drill (not HA, not an SLA): quiet tenant 1 key vs noisy tenant 0 member keys at 0x the quiet tenant's request rate (1x per key); ingest batches of 10 runtime_verdict events (3:1 with policy polls).",
  "environment_label": "local-single-host-engineering-drill",
  "base_url_env": "AIDR_LOAD_BASE_URL",
  "duration_seconds": 600,
  "rate_per_second": 1.818,
  "max_in_flight": 400,
  "request_timeout_ms": 10000,
  "max_response_bytes": 1048576,
  "max_fault_event_samples": 1000000,
  "scenarios": [
    {
      "name": "quiet-ingest",
      "cohort": "quiet_tenant",
      "method": "POST",
      "path": "/functions/v1/ingest",
      "weight": 3,
      "expected_statuses": [
        200
      ],
      "headers_env": {
        "Authorization": "DRILL_AUTH_QUIET"
      },
      "body_json": {
        "iid": "soak-quiet-1",
        "agent_runtime": "claude_code",
        "agent_runtime_version": "drill",
        "aidr_version": "0.0.0-drill",
        "events": [
          {
            "event_id": {
              "$request_id": true
            },
            "type": "runtime_verdict",
            "ts": {
              "$timestamp": true
            },
            "decision": "deny",
            "severity": "high",
            "tool_name": "Bash",
            "threat_id": "cmd-curl-pipe-shell",
            "confidence": 0.93,
            "connector": "claude_code"
          },
          {
            "event_id": {
              "$request_id": true
            },
            "type": "runtime_verdict",
            "ts": {
              "$timestamp": true
            },
            "decision": "deny",
            "severity": "high",
            "tool_name": "Bash",
            "threat_id": "cmd-curl-pipe-shell",
            "confidence": 0.93,
            "connector": "claude_code"
          },
          {
            "event_id": {
              "$request_id": true
            },
            "type": "runtime_verdict",
            "ts": {
              "$timestamp": true
            },
            "decision": "deny",
            "severity": "high",
            "tool_name": "Bash",
            "threat_id": "cmd-curl-pipe-shell",
            "confidence": 0.93,
            "connector": "claude_code"
          },
          {
            "event_id": {
              "$request_id": true
            },
            "type": "runtime_verdict",
            "ts": {
              "$timestamp": true
            },
            "decision": "deny",
            "severity": "high",
            "tool_name": "Bash",
            "threat_id": "cmd-curl-pipe-shell",
            "confidence": 0.93,
            "connector": "claude_code"
          },
          {
            "event_id": {
              "$request_id": true
            },
            "type": "runtime_verdict",
            "ts": {
              "$timestamp": true
            },
            "decision": "deny",
            "severity": "high",
            "tool_name": "Bash",
            "threat_id": "cmd-curl-pipe-shell",
            "confidence": 0.93,
            "connector": "claude_code"
          },
          {
            "event_id": {
              "$request_id": true
            },
            "type": "runtime_verdict",
            "ts": {
              "$timestamp": true
            },
            "decision": "deny",
            "severity": "high",
            "tool_name": "Bash",
            "threat_id": "cmd-curl-pipe-shell",
            "confidence": 0.93,
            "connector": "claude_code"
          },
          {
            "event_id": {
              "$request_id": true
            },
            "type": "runtime_verdict",
            "ts": {
              "$timestamp": true
            },
            "decision": "deny",
            "severity": "high",
            "tool_name": "Bash",
            "threat_id": "cmd-curl-pipe-shell",
            "confidence": 0.93,
            "connector": "claude_code"
          },
          {
            "event_id": {
              "$request_id": true
            },
            "type": "runtime_verdict",
            "ts": {
              "$timestamp": true
            },
            "decision": "deny",
            "severity": "high",
            "tool_name": "Bash",
            "threat_id": "cmd-curl-pipe-shell",
            "confidence": 0.93,
            "connector": "claude_code"
          },
          {
            "event_id": {
              "$request_id": true
            },
            "type": "runtime_verdict",
            "ts": {
              "$timestamp": true
            },
            "decision": "deny",
            "severity": "high",
            "tool_name": "Bash",
            "threat_id": "cmd-curl-pipe-shell",
            "confidence": 0.93,
            "connector": "claude_code"
          },
          {
            "event_id": {
              "$request_id": true
            },
            "type": "runtime_verdict",
            "ts": {
              "$timestamp": true
            },
            "decision": "deny",
            "severity": "high",
            "tool_name": "Bash",
            "threat_id": "cmd-curl-pipe-shell",
            "confidence": 0.93,
            "connector": "claude_code"
          }
        ]
      }
    },
    {
      "name": "quiet-policy",
      "cohort": "quiet_tenant",
      "method": "GET",
      "path": "/functions/v1/policy",
      "weight": 1,
      "expected_statuses": [
        200
      ],
      "headers_env": {
        "Authorization": "DRILL_AUTH_QUIET"
      }
    }
  ],
  "thresholds": {
    "min_requests": 1,
    "max_loss_ratio": 0.01,
    "max_error_ratio": 0.05
  }
}
