{
  "$schema": "./workload-profile.schema.json",
  "schema_version": 1,
  "workload_id": "dashboard-health-local-v1",
  "workload_class": "load",
  "description": "Short loopback harness check. This is not a production capacity result.",
  "environment_label": "isolated-local-rehearsal",
  "base_url_env": "AIDR_LOAD_BASE_URL",
  "duration_seconds": 30,
  "rate_per_second": 10,
  "max_in_flight": 20,
  "request_timeout_ms": 5000,
  "max_response_bytes": 65536,
  "scenarios": [
    {
      "name": "dashboard-health",
      "cohort": "platform",
      "method": "GET",
      "path": "/healthz",
      "weight": 1,
      "expected_statuses": [200],
      "thresholds": {
        "min_requests": 250,
        "max_error_ratio": 0,
        "max_loss_ratio": 0,
        "max_p95_ms": 500
      }
    }
  ],
  "thresholds": {
    "min_requests": 250,
    "max_error_ratio": 0,
    "max_loss_ratio": 0,
    "max_p95_ms": 500,
    "max_p99_ms": 1000
  }
}
