{
  "schema_version": 1,
  "workload_id": "customer-readiness-soak-8h-v1",
  "workload_class": "soak",
  "description": "Operator preparation template. Approve rates and thresholds before running. Health/readiness coverage alone does not prove login, ingest, host enforcement or capacity.",
  "environment_label": "customer-operated-host-awaiting-approval",
  "base_url_env": "AIDR_LOAD_BASE_URL",
  "duration_seconds": 28800,
  "rate_per_second": 1,
  "max_in_flight": 5,
  "request_timeout_ms": 5000,
  "max_response_bytes": 65536,
  "scenarios": [
    {
      "name": "dashboard-liveness",
      "cohort": "platform",
      "method": "GET",
      "path": "/healthz",
      "weight": 1,
      "expected_statuses": [200]
    },
    {
      "name": "dashboard-readiness",
      "cohort": "platform",
      "method": "GET",
      "path": "/readyz",
      "weight": 1,
      "expected_statuses": [200]
    }
  ],
  "thresholds": {
    "min_requests": 28000,
    "max_error_ratio": 0,
    "max_loss_ratio": 0,
    "max_p95_ms": 500,
    "max_p99_ms": 1000
  }
}
